{
  "accepted": true,
  "baselines": {
    "declared_controls": [
      "raw_bit_linear_baseline",
      "template_only_linear_baseline",
      "128_random_label_shuffle_negative_control_probes",
      "256_isotropic_random_same_dimensional_patch_directions",
      "learned_direction_ablation",
      "heldout_nuisance_template_split",
      "activation_noise_stress_curve"
    ],
    "expected_metrics": {
      "ablation_accuracy_max": 0.6,
      "accepted": true,
      "contract_passed": true,
      "dataset": "balanced_xor_with_heldout_template_nuisance_v1",
      "direction_cosine_min": 0.98,
      "exact_ground_truth_checked": true,
      "heldout_accuracy_min": 0.95,
      "heldout_example_count": 32,
      "label_shuffle_accuracy_mean_max": 0.6,
      "learned_patch_target_accuracy_min": 0.9,
      "live_intervention_executed": true,
      "max_allowed_gpu_gb": 24,
      "model_family": "exact_rotated_parity_model",
      "noise_accuracy_at_sigma_1_max": 0.9,
      "paired_accuracy_delta_min": 0.3,
      "peak_vram_gb_max": 1.0,
      "preflight_passed": true,
      "random_patch_target_accuracy_mean_max": 0.2,
      "raw_bits_accuracy_max": 0.6,
      "scientific_result_executed": true,
      "template_only_accuracy_max": 0.6,
      "tests_passed": true,
      "train_example_count": 48
    }
  },
  "claim_scope": "A ridge probe fitted to an exact rotated parity model recovers the analytically known distributed XOR direction, generalizes to 32 examples from eight held-out nuisance templates, and transfers counterfactual donor answers by changing only that direction. The claim is limited to method validation on this model organism.",
  "datasets": [
    {
      "examples_per_template": 4,
      "heldout_example_count": 32,
      "heldout_templates": [
        12,
        13,
        14,
        15,
        16,
        17,
        18,
        19
      ],
      "id": "balanced_xor_with_heldout_template_nuisance_v1",
      "label_rule": "signed_bit_product",
      "source": "generated_exact_enumeration",
      "train_example_count": 48,
      "train_templates": [
        0,
        1,
        2,
        3,
        4,
        5,
        6,
        7,
        8,
        9,
        10,
        11
      ]
    }
  ],
  "date_run": "2026-09-04T23:53:27+00:00",
  "evidence_level": "exact_ground_truth_parity_direction_with_heldout_causal_controls",
  "git_commit": "8eab192b",
  "gpu_name": "NVIDIA GeForce RTX 5090 Laptop GPU",
  "gt_tier": "GT-4",
  "known_failures": [],
  "metrics": {
    "gpu_evidence": {
      "category": "cuda_section_metric",
      "placeholder_only": false,
      "section_specific_metric_keys": [
        "ablation_accuracy",
        "ablation_drop",
        "accepted",
        "best_random_direction_alignment",
        "best_random_patch_target_accuracy",
        "contract_passed",
        "d_model",
        "dataset",
        "direction_cosine",
        "exact_ground_truth_checked",
        "exact_patch_target_accuracy",
        "heldout_accuracy",
        "heldout_example_count",
        "heldout_template_count",
        "label_shuffle_accuracy_mean",
        "label_shuffle_accuracy_p95",
        "learned_patch_target_accuracy",
        "live_intervention_executed",
        "max_allowed_gpu_gb",
        "model_family",
        "noise_accuracies",
        "noise_accuracy_at_sigma_1",
        "noise_sigmas",
        "paired_accuracy_delta",
        "paired_accuracy_delta_ci_high",
        "paired_accuracy_delta_ci_low",
        "preflight_passed",
        "preregistered_criteria",
        "random_patch_target_accuracy_mean",
        "random_patch_target_accuracy_median",
        "random_patch_target_accuracy_p95",
        "raw_bits_accuracy",
        "scientific_result_executed",
        "template_only_accuracy",
        "tests_passed",
        "train_example_count",
        "train_template_count"
      ],
      "uses_cuda": true
    },
    "gpu_test": {
      "ablation_accuracy": 0.5,
      "ablation_drop": 0.5,
      "accepted": true,
      "best_random_direction_alignment": 0.8104840008252583,
      "best_random_patch_target_accuracy": 1.0,
      "contract_passed": true,
      "cuda_available": true,
      "cuda_version": "13.2",
      "d_model": 8,
      "dataset": "balanced_xor_with_heldout_template_nuisance_v1",
      "device": "NVIDIA GeForce RTX 5090 Laptop GPU",
      "direction_cosine": 1.0,
      "exact_ground_truth_checked": true,
      "exact_patch_target_accuracy": 1.0,
      "full_path": "Recover the exact distributed XOR direction, evaluate held-out templates, run causal patches, compare isotropic random directions, and stress-test noise.",
      "gpu_total_memory_gb": 23.45965576171875,
      "heldout_accuracy": 1.0,
      "heldout_example_count": 32,
      "heldout_template_count": 8,
      "label_shuffle_accuracy_mean": 0.525390625,
      "label_shuffle_accuracy_p95": 0.8125,
      "learned_patch_target_accuracy": 1.0,
      "live_intervention_executed": true,
      "max_allowed_gpu_gb": 24.0,
      "model_family": "exact_rotated_parity_model",
      "noise_accuracies": [
        1.0,
        1.0,
        0.978759765625,
        0.840576171875,
        0.685791015625,
        0.622314453125
      ],
      "noise_accuracy_at_sigma_1": 0.840576171875,
      "noise_sigmas": [
        0.0,
        0.25,
        0.5,
        1.0,
        2.0,
        3.0
      ],
      "paired_accuracy_delta": 0.5,
      "paired_accuracy_delta_ci_high": 0.6875,
      "paired_accuracy_delta_ci_low": 0.3125,
      "peak_vram_gb": 0.06377029418945312,
      "preflight_passed": true,
      "preregistered_criteria": {
        "direction_cosine_at_least_0_98": true,
        "heldout_accuracy_at_least_0_95": true,
        "patch_beats_random_mean_by_0_70": true,
        "patch_target_accuracy_at_least_0_90": true,
        "raw_and_template_baselines_at_most_0_60": true
      },
      "random_patch_target_accuracy_mean": 0.056640625,
      "random_patch_target_accuracy_median": 0.0,
      "random_patch_target_accuracy_p95": 0.5,
      "raw_bits_accuracy": 0.5,
      "scientific_result_executed": true,
      "template_only_accuracy": 0.5,
      "tests_passed": true,
      "torch_version": "2.12.1+cu132",
      "train_example_count": 48,
      "train_template_count": 12,
      "within_vram_budget": true
    },
    "notebook_contract": {
      "ablation_accuracy": 0.5,
      "ablation_drop": 0.5,
      "accepted": true,
      "best_random_direction_alignment": 0.8104840008252584,
      "best_random_patch_target_accuracy": 1.0,
      "contract_passed": true,
      "d_model": 8,
      "dataset": "balanced_xor_with_heldout_template_nuisance_v1",
      "direction_cosine": 1.0,
      "exact_patch_target_accuracy": 1.0,
      "heldout_accuracy": 1.0,
      "heldout_example_count": 32,
      "heldout_template_count": 8,
      "label_shuffle_accuracy_mean": 0.525390625,
      "label_shuffle_accuracy_p95": 0.8125,
      "learned_patch_target_accuracy": 1.0,
      "model_family": "exact_rotated_parity_model",
      "noise_accuracies": [
        1.0,
        1.0,
        0.978759765625,
        0.840576171875,
        0.685791015625,
        0.622314453125
      ],
      "noise_accuracy_at_sigma_1": 0.840576171875,
      "noise_sigmas": [
        0.0,
        0.25,
        0.5,
        1.0,
        2.0,
        3.0
      ],
      "paired_accuracy_delta": 0.5,
      "paired_accuracy_delta_ci_high": 0.6875,
      "paired_accuracy_delta_ci_low": 0.3125,
      "preregistered_criteria": {
        "direction_cosine_at_least_0_98": true,
        "heldout_accuracy_at_least_0_95": true,
        "patch_beats_random_mean_by_0_70": true,
        "patch_target_accuracy_at_least_0_90": true,
        "raw_and_template_baselines_at_most_0_60": true
      },
      "random_patch_target_accuracy_mean": 0.056640625,
      "random_patch_target_accuracy_median": 0.0,
      "random_patch_target_accuracy_p95": 0.5,
      "raw_bits_accuracy": 0.5,
      "template_only_accuracy": 0.5,
      "tests_passed": true,
      "train_example_count": 48,
      "train_template_count": 12
    }
  },
  "models": [
    {
      "d_model": 8,
      "gated": false,
      "id": "exact_rotated_parity_model",
      "mechanism": "orthogonally_mixed_exact_xor_feature",
      "precision": "float64",
      "revision": "rotation_seed_7",
      "source": "section_reference_implementation"
    }
  ],
  "negative_controls": {
    "declared_controls": [
      "128_random_label_shuffle_negative_control_probes",
      "256_isotropic_random_same_dimensional_patch_directions"
    ]
  },
  "notebook_id": "10_1_capstone_research_sprint",
  "ood_tests": {
    "declared": "required_where_applicable"
  },
  "peak_vram_gb": 0.06377029418945312,
  "report_inputs": {
    "algorithm": "sha256",
    "combined_sha256": "eff2b7abf9a38c021f1d5d304fd9ce51091d90639994fa524c23c16d09bb5c96",
    "files": [
      {
        "path": "arena_ext/notebook_checks.py",
        "sha256": "0033fd8978a45bf0cf5dd7ce790bb234add9d63c564c76479c0d8eb86973bacc",
        "size_bytes": 1627
      },
      {
        "path": "arena_ext/verification.py",
        "sha256": "d9a5c72b6b6af35eedc860807d1806d16a0ad7d88acd54334d3883d9859a3721",
        "size_bytes": 9276
      },
      {
        "path": "chapter10_capstone_research_sprint/exercises/part1_capstone_research_sprint/10.1_Capstone_Research_Sprint_exercises.ipynb",
        "sha256": "a8041732d548e982703cfaa1a24112a78daa4184818c4982b6f21628cbbbfcf7",
        "size_bytes": 51899
      },
      {
        "path": "chapter10_capstone_research_sprint/exercises/part1_capstone_research_sprint/10.1_Capstone_Research_Sprint_solutions.ipynb",
        "sha256": "2bace620d844dbc372f43c4cbe122e38741feebc9d7ef21740b8f3ec126cdc9a",
        "size_bytes": 198405
      },
      {
        "path": "chapter10_capstone_research_sprint/exercises/part1_capstone_research_sprint/README.md",
        "sha256": "516fbe490c5192a45daba6e8799d7beae187cbbb86800336604bfed3475eb794",